{
  "case_id": "GUIDING-CASE-239",
  "case_name": "王某诉北京某文化传媒有限公司劳动争议案",
  "case_number": "（2023）京03民终7051号",
  "court": "北京市第三中级人民法院",
  "year": 2023,
  "case_type": "劳动争议",
  "cause": "劳动争议",
  "case_facts": "网络主播与传媒公司签订独家经纪合同，收入按交易金额分成，主播对结算具有异议权。双方就是否存在劳动关系以及奖金、未签书面劳动合同责任发生争议。",
  "dispute_issues": ["经纪公司与网络主播之间是否存在支配性劳动管理", "经纪合同履约要求能否认定为劳动管理"],
  "first_instance_result": "北京市朝阳区人民法院驳回网络主播的诉讼请求。",
  "second_instance_result": "北京市第三中级人民法院驳回上诉，维持原判。",
  "judgment_reason": "劳动关系以支配性劳动管理为本质特征。公司对主播工作时间、内容和过程控制不强，主播对利益分配具有较强议价权，不具有较强人格、经济和组织从属性。",
  "legal_basis": ["劳动关系从属性及实际用工认定规则"],
  "lawyer_strategy": ["审查工作时间和工作量自主程度", "固定平台规则、考核奖惩及收入议价证据", "区分经纪合同履约要求与支配性劳动管理"],
  "keywords": ["劳动争议", "网络主播", "经纪合同", "劳动关系", "支配性劳动管理", "从属性"],
  "source_level": "A",
  "source": "https://www.court.gov.cn/zixun/xiangqing/450651.html"
}
