{
  "case_id": "GUIDING-CASE-167",
  "case_name": "北京大唐燃料有限公司诉山东百富物流有限公司买卖合同纠纷案",
  "case_number": "（2019）最高法民终6号",
  "court": "最高人民法院",
  "year": 2019,
  "case_type": "合同纠纷",
  "cause": "买卖合同纠纷",
  "case_facts": "买卖双方在多份采购合同中滚动结算。债权人先提起代位权诉讼，但因次债务人无可供执行财产而终结本次执行，后就未实际清偿部分向债务人主张返还货款。",
  "dispute_issues": ["代位权判决未实际执行清偿时原债权是否消灭", "另行起诉债务人是否构成重复起诉"],
  "first_instance_result": "山东省高级人民法院判令返还部分货款及相应利息。",
  "second_instance_result": "最高人民法院撤销一审并改判返还153468000元货款及相应利息，驳回其他诉讼请求。",
  "judgment_reason": "代位权制度以实际清偿为债权债务消灭前提；终结本次执行不等于债权已经实现。代位权诉讼与对债务人的诉讼在当事人、诉讼标的和请求基础上不同，不构成重复起诉。",
  "legal_basis": ["《中华人民共和国民法典》第五百三十七条", "《最高人民法院关于适用〈中华人民共和国民事诉讼法〉的解释》第二百四十七条"],
  "lawyer_strategy": ["核验代位权案件实际清偿金额及执行状态", "保留终结本次执行裁定和未获清偿证据", "区分前后诉的当事人、标的与诉讼请求"],
  "keywords": ["买卖合同", "代位权", "终结本次执行", "未获清偿", "重复起诉", "货款"],
  "source_level": "A",
  "source": "https://www.court.gov.cn/zixun/xiangqing/331181.html"
}
